{
  "receipt_id": "decision-example-agent-beta-001",
  "receipt_version": "1.0",
  "decision_type": "accept",
  "subject": {
    "subject_id": "did:web:example.invalid:agents:beta",
    "subject_type": "agent",
    "display_name": "Example Agent Beta",
    "uri": "https://example.invalid/agents/beta"
  },
  "decision_maker": {
    "id": "did:web:example.invalid:verifier",
    "name": "Example Relying Party Verifier",
    "role": "relying_party",
    "system_version": "verifier-0.7.0"
  },
  "policy_reference": {
    "uri": "https://example.invalid/policies/agent-beta-reliance-policy.json",
    "policy_id": "policy.example.agent-beta.reliance.v1",
    "media_type": "application/json",
    "sha256": "9999999999999999999999999999999999999999999999999999999999999999",
    "profile": "odrl-policy-reference"
  },
  "evaluated_artifacts": [
    {
      "uri": "https://example.invalid/anab/example.agent.beta/conformance.json",
      "media_type": "application/json",
      "sha256": "1111111111111111111111111111111111111111111111111111111111111111",
      "role": "declaration",
      "schema_uri": "https://raw.githubusercontent.com/sankarshanmukhopadhyay/trust-infrastructure-schemas/v0.9.0/conformance/conformance-declaration.schema.json"
    },
    {
      "uri": "https://example.invalid/anab/example.agent.beta/evidence.json",
      "media_type": "application/json",
      "sha256": "2222222222222222222222222222222222222222222222222222222222222222",
      "role": "evidence",
      "fresh_until": "2026-06-25T00:00:00Z"
    },
    {
      "uri": "https://example.invalid/oasf/evaluations/example-agent-beta.json",
      "media_type": "application/json",
      "sha256": "3333333333333333333333333333333333333333333333333333333333333333",
      "role": "evaluation"
    }
  ],
  "authority_boundary": {
    "statement": "The verifier accepts the agent identity and registry-discovery posture for the declared scope only. This receipt does not grant autonomous runtime delegation.",
    "authority_type": "verifier",
    "authoritative_party": "Example Relying Party Verifier",
    "authority_id": "did:web:example.invalid:verifier",
    "delegation_required": true,
    "revocation_actor": "Example Sponsor Authority",
    "revocation_uri": "https://example.invalid/agents/beta/revocation",
    "scope": [
      "identity-state",
      "registry-discovery",
      "assurance-evaluation"
    ],
    "relying_party_constraints": [
      "Check revocation status before reuse.",
      "Require a separate task delegation artifact for runtime action."
    ]
  },
  "assurance": {
    "assurance_level": "AL3",
    "controls_checked": [
      "ANAGB-RES-01",
      "ANAGB-AUTH-01",
      "ANAGB-A2A-07"
    ],
    "evaluator_uri": "https://example.invalid/oasf/evaluations/example-agent-beta.json",
    "evidence_bundle_uri": "https://example.invalid/anab/example.agent.beta/evidence.json"
  },
  "result": {
    "status": "passed",
    "summary": "The evaluated declaration, evidence bundle, and evaluation envelope satisfy the relying-party policy for identity-state reliance.",
    "allowed_actions": [
      "display-registry-status",
      "accept-identity-posture"
    ],
    "prohibited_actions": [
      "execute-delegated-task",
      "bypass-revocation-check"
    ],
    "conditions": [
      "Evidence must remain fresh.",
      "Delegation must be checked separately for runtime actions."
    ]
  },
  "timestamps": {
    "decided_at": "2026-03-25T00:05:00Z",
    "valid_until": "2026-04-01T00:00:00Z",
    "evidence_fresh_until": "2026-06-25T00:00:00Z"
  },
  "evidence": [
    "https://example.invalid/anab/example.agent.beta/evidence.json",
    "https://example.invalid/oasf/evaluations/example-agent-beta.json"
  ],
  "integrity": {
    "hash_algorithm": "sha256",
    "receipt_hash": "aaaaaaaaaaaaaaaaaaaaaaaaaaaaaaaaaaaaaaaaaaaaaaaaaaaaaaaaaaaaaaaa",
    "signed": false
  }
}
