{
  "receipt_id": "tsmm-mapped-decision-agent-beta-001",
  "receipt_version": "1.0",
  "decision_type": "accept",
  "subject": {
    "subject_id": "did:web:example.invalid:agents:beta",
    "subject_type": "agent",
    "display_name": "Example Agent Beta",
    "uri": "https://example.invalid/agents/beta"
  },
  "decision_maker": {
    "id": "did:web:example.invalid:verifier",
    "name": "Example Relying Party Verifier",
    "role": "relying_party",
    "system_version": "verifier-0.8.0"
  },
  "policy_reference": {
    "uri": "https://example.invalid/policies/runtime-reliance-policy.json",
    "policy_id": "policy.example.agent-beta.runtime-reliance.v1",
    "media_type": "application/json",
    "sha256": "7777777777777777777777777777777777777777777777777777777777777777",
    "profile": "odrl-policy-reference"
  },
  "evaluated_artifacts": [
    {
      "uri": "https://example.invalid/tis/authority/agent-beta-boundary.json",
      "media_type": "application/json",
      "sha256": "4444444444444444444444444444444444444444444444444444444444444444",
      "role": "evidence",
      "schema_uri": "https://raw.githubusercontent.com/sankarshanmukhopadhyay/trust-infrastructure-schemas/v0.8.0/governance/authority-boundary.schema.json"
    },
    {
      "uri": "https://example.invalid/tis/evidence/agent-beta-bundle.json",
      "media_type": "application/json",
      "sha256": "6666666666666666666666666666666666666666666666666666666666666666",
      "role": "evidence",
      "schema_uri": "https://raw.githubusercontent.com/sankarshanmukhopadhyay/trust-infrastructure-schemas/v0.8.0/evidence/evidence-bundle-manifest.schema.json"
    },
    {
      "uri": "https://example.invalid/tis/evaluations/agent-beta.json",
      "media_type": "application/json",
      "sha256": "8888888888888888888888888888888888888888888888888888888888888888",
      "role": "evaluation",
      "schema_uri": "https://raw.githubusercontent.com/sankarshanmukhopadhyay/trust-infrastructure-schemas/v0.8.0/oasf/oasf-evaluation-envelope.schema.json"
    }
  ],
  "authority_boundary": {
    "statement": "TSMM authority edge sponsor-to-agent-beta permits identity-state reliance only; runtime task authority remains scope-limited and revocation-sensitive.",
    "authority_type": "sponsor",
    "authoritative_party": "Example Sponsor Authority",
    "authority_id": "did:web:example.invalid:sponsor-authority",
    "delegation_required": true,
    "revocation_actor": "Example Sponsor Authority",
    "revocation_uri": "https://example.invalid/agents/beta/revocation",
    "scope": [
      "identity-state",
      "submit-status-update"
    ],
    "relying_party_constraints": [
      "Check revocation status before reuse.",
      "Reject requests outside the submit-status-update scope."
    ],
    "notes": "Derived from TSMM authority graph edge sponsor-to-agent-beta."
  },
  "assurance": {
    "assurance_level": "AL3",
    "controls_checked": [
      "AUTH-BOUNDARY-01",
      "EVID-BUNDLE-01",
      "DECISION-RECEIPT-01"
    ],
    "evaluator_uri": "https://example.invalid/tis/evaluations/agent-beta.json",
    "evidence_bundle_uri": "https://example.invalid/tis/evidence/agent-beta-bundle.json"
  },
  "result": {
    "status": "passed",
    "summary": "TSMM-modeled authority and TIS-packaged evidence satisfy relying-party policy for a bounded status-update effect.",
    "allowed_actions": [
      "submit-status-update"
    ],
    "prohibited_actions": [
      "initiate-payment",
      "modify-registry-entry",
      "delegate-onward"
    ],
    "conditions": [
      "Evidence must remain fresh.",
      "Revocation status must be rechecked before reuse.",
      "Any expanded effect requires a new decision receipt."
    ]
  },
  "timestamps": {
    "decided_at": "2026-05-05T00:20:00Z",
    "valid_until": "2026-05-06T00:00:00Z",
    "evidence_fresh_until": "2026-05-06T00:00:00Z"
  },
  "evidence": [
    "https://example.invalid/tis/evidence/agent-beta-bundle.json",
    "https://example.invalid/tis/evaluations/agent-beta.json"
  ],
  "integrity": {
    "hash_algorithm": "sha256",
    "receipt_hash": "9999999999999999999999999999999999999999999999999999999999999999",
    "signed": false
  }
}
